text,coarse_label
"Where is Hearst Castle , built by publisher William Randolph Hearst ?",location
What 's the largest U.S. city on the Great Lakes ?,location
Who sang about Desmond and Molly Jones ?,human
"What magazine gives us the cream , not the skim ?",entity
What does the technique called `` cold fusion '' produce ?,entity
What costume designer decided that Michael Jackson should only wear one glove ?,human
"What meter did Shakespeare use in writing : `` To be , or not to be , that is the question.. . '' ?",entity
How many rows of sprocket holes does a roll of 35-millimeter film have ?,numeric
What is the goat population of the world ?,numeric
What company was the original sponsor of TV 's Superman ?,human
What term does a Czech use to describe a Pole ?,entity
What sea separates Naples and Algiers ?,location
How many lawyers are there in the state of New Jersey ?,numeric
What are the most common elements in seawater ?,entity
Describe the Finnish music personality Salonen 's appearance .,description
What is the origin of the ethnic category `` caucasian '' ?,description
What is a stratocaster ?,description
What kind of science is cosmology ?,entity
Name the blind sculptress in love with the Fantastic Four 's Thing .,human
What 's the second-lightest element ?,entity
What do you call a `` twirl '' in ballet ?,entity
What is the brand name of daminozide ?,entity
What is the former name of Zimbabwe ?,entity
What National Basketball Association superstar told his story in Giant Steps ?,human
What animals did The Amazing Three masquerade as ?,entity
How did the bikini bathing suite get its name ?,description
When did Fraze get his first patent for the pull-tab can ?,numeric
How many games are played in a five-team round-robin tournament ?,numeric
Who developed the first polio vaccine ?,human
Who made the first gas engine ?,human
"What country claimed Rubens , Van Dyck and Bruegel as citizens ?",location
What civil war was fought between 1936 and 1939 ?,entity
How many questions do you have on your database ?,numeric
How do clouds form ?,description
Where can I find examples of legal cases about the Individuals with Disabilities Education Act ?,location
What character did Tex Avery first create upon arriving at MGM ?,human
When was the Triangle Shirtwaist fire ?,numeric
What Asian spiritual and political leader was married at the age of 13 ?,human
Where is Ocho Rios ?,location
What is the half-life of P-32 ?,description
What ocean does Mauritania border ?,location
Why do pressure cookers save time in the kitchen ?,description
Why are there 12 people on a jury in criminal cases ?,description
What do Christian Scientists believe in ?,description
"What World War I battle saw 6 , 0 troops killed in one day ?",entity
What country is Kosovo a part of ?,location
Tell me what city the Kentucky Horse Park is near ?,location
What computer operating system is on the most computers ?,entity
What is Bill Gross 's email address ?,location
What is the economic impact of unemployment on the economy ?,description
"What do the letters D.C. stand for in Washington , D.C. ?",abbreviation
What animals can live the longest without food ?,entity
What English queen had seventeen children ?,human
"What is the approximate population of Las Vegas , N.M ?",numeric
How much does the President get paid ?,numeric
What two baseball players make up the battery ?,human
What 's the largest letter in Salvador Dali 's signature ?,entity
What does an irate car owner call iron oxide ?,entity
"Of children between the ages of two and eleven , what percentage watch `` The Simpsons '' ?",numeric
What 's the northernmost U.S. state apart from Alaska ?,location
Name an art gallery in New York .,location
Who sells Viagra ?,human
What musical instrument did Prewitt play in James Jones 's From Here to Eternity ?,entity
What is the Home Rule Act ?,description
What building are British monarchs crowned in ?,location
What are Bellworts ?,description
Who was Darius ?,human
What movie told of Anna Anderson 's claim to be a Russian czar 's daughter ?,entity
Who did Dita Beard work for ?,human
What kind of creature is a coot ?,entity
Name the university of which Woodrow Wilson was president .,human
"What country was first to use the airplane as a weapon of war , against the Turks in Libya ?",location
What university was Woodrow Wilson President of ?,human
What is a fear of disease ?,entity
What kind of meat is Fray Bentos synonymous with ?,entity
What did Mr. Magoo flog on TV for General Electric ?,entity
What are the words to the Canadian National anthem ?,description
What is the name of the Jewish alphabet ?,entity
Who served as inspiration for the schoolteacher portrayed by Robin Williams in `` Dead Poets Society '' ?,human
What is Columbia Tristar 's phone number ?,numeric
Name the five positions who are in the line of succession to the presidency .,human
Which one of the original seven Mercury program astronauts did not fly on any of the Mercury flights ?,human
Who is the best known villain of the 165 Gunpowder Plot ?,human
What is the capital of Burkina Faso ?,location
What continent is Bolivia on ?,location
Why was Muhammad Ali stripped of his title and barred from boxing in 1967 ?,description
"Who killed more people , Hitler or Stalin ?",human
What caused Shea & Gould to close their L.A. office ?,description
What 's the only mammal that can 't jump ?,entity
What U.S. state has the most blondes ?,location
What war saw battles at Parrot 's Beak and Black Virgin ?,entity
What was the U.S. highway death toll in 1969 ?,numeric
What does the name Kelly mean ?,description
What is a phalanx ?,description
What mustachioed comedian portrayed Frankie in North to Alaska ?,human
What does each of the utilities cost in Monopoly ?,numeric
"What actor and World War II airman had a $5 , 0 bounty put on his head by Hermann Goering ?",human
What does e.g. stand for ?,abbreviation
What is the name of the medical condition in which a baby is born without a brain ?,entity
How do storms form ?,description
Who is Nicolo Paganini ?,human
What city is often called The Insurance Capital of the World ?,location
What are the three animals in Sheila Burnford 's The Incredible Journey ?,entity
Who portrayed Dracula in Hammer Studios ' films ?,human
Name one of the Seven Wonders of the Ancient World .,entity
When were fish first believed to be found on earth ?,numeric
"What President 's favorite Biblical quotation was : `` Come now , and let us reason together '' .",human
How many elevators do you ride to reach the top floor of the Empire State Building ?,numeric
Name the food company that traveled to Soviet Georgia to film a series of ads .,human
What country was Sir Edmund Hillary born in ?,location
What 's an infant seal called ?,entity
"What was the proper Laugh-In respones to : `` Say goodnight , Dick '' ?",description
What city was John F. Kennedy nominated for president in ?,location
How long does a dog sleep ?,numeric
What 1963 Joseph L. Mankiewicz film cost $28 million ?,entity
What Japanese electronics company was named for a coastal city northeast of Tokyo ?,human
What can you be fined for having a dog on a beach ?,numeric
Where did the Battle of the Bulge take place ?,location
How much will the California be in the year 2000 ?,numeric
"What mystery writer penned `` ...the glory that was Greece , and the grandeur that was Rome '' ?",human
What state full of milk and honey was the destination in The Grapes of Wrath ?,location
What is the tallest building in Japan ?,location
Where is Sinn Fein 's headquarters ?,location
Name Li 'l Abner 's favorite Indian drink .,entity
What are some important events of the 1830 's ?,entity
The Iraqis launched their attack on Kuwait on what day ?,numeric
What letter adorns the flag of Rwanda ?,entity
"What did 8 , CD NNS VBP TO VB NNP POS NN .",entity
What is God ?,description
What country 's northernmost city is Darwin ?,location
"What sound does Olympia , Washington , overlook ?",location
What TV show chronicled the lives of Katy Holstrum and Congressman Glen Morley ?,entity
What Kentucky city calls itself The Horse Center of America ?,location
How many penny-farthings are there on a Trivial Pursuit game board ?,numeric
What 's the most abundant element in the sun ?,entity
"What European country boasts the city of Furth , found where the rivers Rednitz and Pegnitz converge ?",location
What U.S. state is Dixville Notch in ?,location
"Where was the Cisalpine Republic , 1797-185 , ?",location
What is the largest shopping mall in the world ?,location
What is the protagonist 's name in Dostoevski 's `` The Idiot '' ?,human
What penalty space lies between Baltic Avenue and Reading Railroad on a Monopoly board ?,entity
What presidential press secretary dismissed Watergate as a third-rate burglary attempt ?,human
What is a meerkat ?,description
Who was Jean Nicolet ?,human
What kind of animal was Winnie the Pooh ?,entity
Which of these are authors ?,human
What 's the international radio code word for the letter B ?,entity
Who was the original Humpty Dumpty ?,human
What is cache memory ?,description
Aspartame is also known as what ?,entity
Where is the location of the Orange Bowl ?,location
When is President Nixon 's birthday ?,numeric
"What is the origin of the midwest slang , ` you 're darn tootin ' ?",description
Whose cupboard was bare ?,human
What are the seven seas ?,location
What does IBM stand for ?,abbreviation
What is the difference between jazz and blues ?,description
What is the C programming language ?,description
What 's the name of Popeye 's adopted son ?,human
Who invented the vacuum cleaner ?,human
What is a ` borrow pit ' ?,description
What 2th-century fictional character attends Pencey Prep School ?,human
How many people in the USA say their number one source of information is the newspaper ?,numeric
"Who does Shakespeare 's Antonio borrow 3 , 0 ducats from ?",human
Which country is known as `` Big Bear '' ?,location
"What `` melts in your mouth , not in your hands '' .",entity
How many times a day should you take a prescription marked `` q.i.d . '' ?,numeric
What is the origin of the atom ?,description
Who is the Voyager project manager ?,human
Which radio stations air the Jim Bohannon Radio Talk Show ?,human
What two commanders directed the forces in the Battle of El Alamein ?,human
Name the creator of `` The Muppets '' .,human
How do I e-mail someone at aol.com from yahoo.com ?,description
Who replies `` I know '' to Princess Leia 's confession `` I love you '' in The Empire Strikes Back ?,human
What is the meaning of the name Ella ?,description
What 's the home of the Rockettes ?,location
"Where can I find all the information I need to know about the English Civil War , 1642-1649 , ?",location
What is the name of the firm that makes Spumante ?,human
What sport is played on the largest field ?,entity
Who won the 1967 Academy Award for Best Actor ?,human
What is after death ?,entity
Name the first private citizen to fly in space .,human
What was football star Elroy Hirsch 's nickname ?,human
What singer sings `` Oh Boy '' ?,human
How much pizza do Americans eat in a day ?,numeric
What is the website for the USA journal ?,location
What army 's motto is Blood and Fire ?,human
What kind of patent did Ermal Fraze get in 1963 ?,entity
What are you hearing when you put a seashell to your ear ?,description
Why are haunted houses popular ?,description
Which gender has bigger thighs ?,entity
What U.S. state has the second-longest coastline ?,location
What state 's home to the Buffalo Bill Historical Center ?,location
How fast do cheetahs run ?,numeric
What is Ray Bradbury 's illustrated man illustrated with ?,entity
How fast is a 45Mhz processor ?,numeric
"What kind of puzzle first appeared in the U.S. in the New York World on December 21 , 1913 ?",entity
What count did Alexandre Dumas write about ?,human
What are the odds of giving birth to twins ?,numeric
What is the largest natural lake in Pennsylvania ?,location
How far is London UK from California ?,numeric
Name the two mystical ravens Odin has at his command .,entity
What was the species of Winnie the Pooh ?,entity
What is the virus HIV ?,description
How many years old is Benny Carter ?,numeric
What Hermann Hesse book gave its name to a rock group ?,entity
Where does the Santa Fe Trail begin and end ?,location
What book is the follow-up to Future Shock ?,entity
What African animals are known as The Big Five ?,entity
What is the alphabet for Latin ?,entity
What is the fear of frogs ?,entity
Which city in Canada is the least-populated ?,location
How old is Stevie Wonder ?,numeric
Who was the first Taiwanese President ?,human
Who is Luke Skywalker 's father ?,human
What does a dipsomaniac crave ?,entity
What is the definition of the term `` weapons system '' ?,description
What are Christopher Marlowe 's and Shakespeare 's literary contributions to English literature ?,description
What is Nero Wolfe 's favorite drink during office hours ?,entity
What is the first personal computer company ?,human
What is the most efficient way to start a barbeque ?,entity
Who was Jane Goodall ?,human
Why are there Braille things on the ATM machines that people drive through ?,description
Where is the Isle of Man ?,location
What book did Aaron Hass write ?,entity
What was the death toll at the eruption of Mount Pinatubo ?,numeric
When will the millennium officially begin ?,numeric
"Who created the comic strip , `` Garfield '' ?",human
Which Vietnamese terrorist is now a UN delegate in Doonesbury ?,human
What is real time processing ?,description
What do we call the imaginary line along the top of the Rocky Mountains ?,location
What country 's capital is Lagos ?,location
Where does Ray Bradbury 's Chronicles take place ?,location
Who is the current prime minister and president of Russia ?,human
Who established a Viking colony in Greenland about 985 ?,human
What was the distinguishing mark on the `` Little Rascals '' dog ?,entity
"What is the latitude and longitude of El Paso , Texas ?",numeric
Where can I get information about cystic fibrosis ?,location
Where did Honecker rule ?,location
What is the theory of equivalence states ?,description
What does a philatelist collect ?,entity
What is the life span of the average monkey ?,numeric
How many member states are in the UN ?,numeric
Who shot and killed himself while painting Wheatfield with Crows ?,human
What will happen when sodium is put in water ?,description
What 's the meaning of UOL ?,description
What future President became Senate majority whip under Harry Truman ?,human
Who was the architect of Central Park ?,human
Which operating system runs on IBM-compatible machines ?,entity
What are the dimensions of an ice hockey goal ?,numeric
When was CNN 's first broadcast ?,numeric
What are the signs of a country going into a recession ?,entity
What is the circumorbital hematoma ?,description
What African country is governed from Ouagadougou ?,location
What was the Christian name of the title character in Our Miss Brooks ?,human
What hard-of hearing artist painted Sunflowers ?,human
Who were the Yankee 's frequent enemies ?,human
Who wrote Sons and Lovers ?,human
What is the English translation for the word `` caliente '' ?,entity
What handicraft requires you to interlace your warp and weft ?,entity
What French seaport claims to be The Home of Wines ?,location
How long does it take sunlight to reach Earth ?,numeric
How many milliseconds in a second ?,numeric
What Cherokee Indian gave his name to a tree ?,human
When were camcorders introduced in Malaysia ?,numeric
What is the chance of conceiving quadruplets ?,numeric
Who was the star of Leave It to Beaver ?,human
What countries have the largest armed forces in the world ?,location
What was William F. Cody 's better-known name ?,human
How do I increase my biceps ' size ?,description
Who did Richard Nixon tender his resignation to ?,human
Who was Thucydides ?,human
How is the element strontium purified ?,description
Which of the following rock 'n roll stars has a `` star '' on Hollywood Boulevard ?,human
What are tonsils for ?,description
"What molecules include fluorine , sodium and magnesium ?",entity
What was the name of the ball game played by the mayans ?,entity
What was the sequel to The Moon 's Balloon ?,entity
What is the exchange rate for Australian to American money ?,numeric
What is the origin of the word ` posh ' ?,description
How can anyone tell if a female had sexual intercourse ?,description
How many states did Richard Nixon carry in 1972 ?,numeric
What basketball maneuver did Bert Loomis invent ?,entity
What is a good book to read for people who hate to read ?,entity
How many shillings more than 2 were there in a guinea ?,numeric
What does a tarantula eat ?,entity
What are the three secondary colors ?,entity
What does the name `` Sabrina '' mean ?,description
Who took over as conductor of the Boston Pops after Arthur Fiedler 's long reign ?,human
What were the trials called which followed World War II ?,entity
What is hebephrenia ?,description
What Nazi leader killed himself in jail just before he was to be executed as a war criminal ?,human
What famous events have happened on March 27 ?,entity
Which company claimed to be `` the world 's biggest toy store '' ?,human
What brand number graces the black label of a bottle of Jack Daniel 's ?,numeric
What do I call the sons and daughters of my first cousins ?,entity
What were the causes of the Civil War ?,description
What are Maid-Rites ?,description
What city is terrorized by Dracula in The Night Stalker ?,location
How can you prevent it ?,description
What do the names Andrew and Christina mean ?,description
What chocolate bar created by Frank Mars and his wife is often called a Milky Way with peanuts ?,entity
Who is the fastest guitarist ?,human
What do camels store in their humps ?,entity
What is the name of the second space shuttle ?,entity
What is the best hospital for orthopedics in the country ?,location
What are perfect tenses ?,description
What is commonly considered the fifth sense ?,description
What was another name for East Germany ?,entity
What 's the second-biggest-selling magazine in America ?,entity
Who betrayed Norway to the Nazis ?,human
Who took the toys donated for the Doodyville Orphans ' Fund and kept them for himself ?,human
What is a bourdon tube ?,description
What kind of a sports team is the Wisconsin Badgers ?,entity
Who were the Picts ?,human
"What do Caroll Baker , Tammy Grimes , Debbie Reynolds , and Judy Garland all have in common ?",description
What is film noir ?,description
Who is stationed at Camp Swampy in the comic strips ?,human
In what year did China and the Republic of Korea establish diplomatic relations ?,numeric
What causes tuberculosis ?,description
How tall is the giraffe ?,numeric
What actor dressed up as Santa Claus and had a once-a-year affair with actress Shelley Winters every Christmas for many years ?,human
What animal was the heat-seeking missile called the Sidewinder named for ?,entity
How long did it take Stanley to find Livingstone ?,numeric
How much of the nation 's children between the ages of two and eleven watch ` The Simpsons ' ?,numeric
What lake is Sheboygan on ?,location
What are a baseball team 's firemen ?,description
What is a fear of color ?,entity
What Nantucket shipwreck killed more divers exploring it than the 52 people it sank with ?,entity
What are the two largest birds on earth ?,entity
Name the four stories contained in Edith Wharton 's `` Old New York . '',entity
What is the largest lake in North America ?,location
How many people died because of a smoking problem in 1997 ?,numeric
What is chronic constipation a symptom of ?,entity
Who wrote The Look of Love after viewing Ursula Andress ?,human
What is the name of the American swimmer who won seven gold medals in the 1972 Olympics ?,human
Who claims to have the greatest show on earth ?,human
What is Head Start ?,description
What Honeymooners actress did Television magazine name as 1953 's most promising star ?,human
Why can 't women serve in the Navy on board submarines ?,description
What did the Yalta Conference lead to ?,entity
What dog was dubbed The Mortgage Lifter ?,entity
What is saltpeter ?,description
What 's the difference between J.D. and LL.M. ?,description
What kind of organization is ` Last Chance for Animals ' ?,human
What was the role of the Medieval Guild ?,human
Silly putty was invented by whom ?,human
What should the oven be set at for baking Peachy Oat Muffins ?,entity
How can someone become a federal agent ?,description
Who invented the paper clip ?,human
Whom did Lauren Bacall marry after her husband Humphrey Bogart died ?,human
How many times in his 16-year National Basketball Associaton career was John Havlicek a member of the all-star team ?,numeric
What city or state do the most gay men live in ?,location
Shea and Gould had an office in Los Angeles for how long before closing it ?,numeric
"What word occurs 46 , 227 times in the Bible ?",entity
How can you be happy ?,description
How would someone go about becoming an organ donor ?,description
"What year did Degas create the bronze sculpture , `` Fourth Position Front ? ''",numeric
What composer was awarded the Medal of Honor by Franklin D. Roosevelt ?,human
How many URL extensions are there ? and what are they ?,numeric
How long after intercourse does it take to find out if you are pregnant ?,numeric
What does U.S.S.R. stand for ?,abbreviation
"Who created the Fantastic Four , Hulk , and Thor ?",human
What is a fear of gravity ?,entity
Who is the composer of `` Canon in D Major '' ?,human
What did n't Rocky Marciano do in his pro boxing career ?,description
Where are all European and American eels born ?,location
Who was the author of the novel `` Far From the Madding Crowd '' ?,human
What is the definition of ` graphic details ' ?,description
What was `` America 's recessed-filter cigarette '' ?,entity
What kind of dog is Scooby Doo ?,entity
What is the function of the appendix ?,description
What department store heir is responsible for raising a three-ton safe from the underwater wreckage of the Andrea Doria ?,human
Which sex is twice as likely to contract leprosy ?,entity
What was the first town to be chartered in Vermont ?,location
What state has the longest Great Lakes shoreline ?,location
What U.S. state ends with a G ?,location
How many varieties of twins are there ?,numeric
What is a Cartesian Diver ?,description
What are the largest libraries in the US ?,location
How many people live in the Falklands ?,numeric
Who was Camp David named for ?,human
What document did President Andrew Johnson want a copy of placed under his head upon his burial ?,entity
Who portrayed `` the man without a face '' in the movie of the same name ?,human
What happened in dogtown in 1899 to make that year remembered ?,description
What wheel did Blaise Pascal invent in a search for perpetual motion ?,entity
How much money was the minimum wage in 1991 ?,numeric
In what year was the first patent for the pull-tab opener on cans obtained ?,numeric
What country boasts the most dams ?,location
What is the regular price ?,numeric
What Metropolis landmark was first introduced in the Superman cartoons of the 1940 's ?,location
Where can one find Mozambique ?,location
How do you recognize anorexia ?,description
What Mary Tyler Moore Show regular came into the world as Tadeus Wladyslaw Konopka ?,entity
In what city is the US Declaration of Independence located ?,location
What is the largest variety of cactus ?,description
Who won the first World Series ?,human
What did Aaron Hass write ?,entity
Who is Samuel Pickering ?,human
What was the business of the animated Sky Hawks ?,human
Who was credited with saying : `` I never met a man I did n't like '' ?,human
"What overalls are named for Dungri , a suburb of Bombay ?",entity
Why do rooftops give off steam after a big rainstorm ?,description
What nationality was Jackson Pollock ?,location
How much of the earth 's surface is permanently frozen ?,numeric
What is the connection between New Krypton and Daxam ?,entity
When was Queen Victoria born ?,numeric
How many people were executed for Abraham Lincoln 's assassination ?,numeric
What must a Las Vegas blackjack dealer do when he reaches 16 ?,description
What is worth seeing in Reims ?,location
What type of performer is Ileana Cotrubas ?,entity
When was Yemen reunified ?,numeric
What line of candy products included Super Skrunch and Peanut Butter Oompas ?,entity
Why did the Anglican church split from the Vatican ?,description
What organization has a Security Council ?,human
How would I find the price of different organs that have been donated ?,description
What Mexican leader was shot dead in 1923 ?,human
What does NECROSIS mean ?,abbreviation
What is magnetar ?,description
"What feud ended with a marriage in Kentucky on March 21 , 1891 ?",entity
What color is the stripe along each side of a Coho salmon ?,entity
What is the federal minimum wage ?,numeric
Mississippi is nicknamed what ?,entity
What are the unemployment statistics for the years 1965 and 1990 ?,numeric
Where is Santa Lucia ?,location
What female painter produced primitives of rural New England life ?,human
What are names of two old men who appear in the serial tv Muppets Show ?,human
What war saw battles at Parrot 's Beak and Black Virgin ?,entity
What should you yell to hail a taxi in Madrid ?,description
What is the horsepower of the shuttle boosters ?,numeric
What year did Apartheid start ?,numeric
Who created Big Ben ?,human
What city is found in the city of OZ ?,location
What ever happened to the once popular Yale Lock Company ?,description
Name the Marvel team loosely based on DC 's Justice League of America ?,human
What did a 16th-century Aztec athlete get for putting a rubber ball through a ring ?,entity
"What populous state covers 49 , 576 square miles ?",location
